{
  "presentation_id": "pres-saas-001",
  "skill_id": "ms.skill.presentation_architecture",
  "skill_version": "0.1.0",
  "presentation_objective": "Secure pilot commitment from mid-market SaaS buyers",
  "presentation_type": "sales_presentation",
  "audience_summary": "VP Operations evaluating workflow automation ROI",
  "narrative_arc": {
    "arc_id": "arc-saas-001",
    "arc_type": "problem_solution",
    "opening": "Manual ops workflows limit growth",
    "context": "Mid-market SaaS teams scaling support and onboarding",
    "problem_or_question": "How to reduce manual handoffs without risky automation",
    "evidence_development": "Pilot customers reduced ticket routing time",
    "central_insight": "Governed automation beats ad-hoc scripts",
    "recommendation_or_solution": "Start with a bounded pilot on one workflow",
    "proof": "Case study with measured routing improvement",
    "objections_or_risks": "Integration effort and change management",
    "conclusion": "Pilot de-risks adoption while proving ROI",
    "call_to_action": "Schedule pilot scoping workshop",
    "target_audience_effect": "Confidence to approve limited pilot",
    "source_references": [{"source_id": "offer-v1", "type": "approved_offer"}],
    "assumptions": ["Audience has existing ticketing system"],
    "limitations": ["No customer logos without approval"],
    "provenance": {"origin": "fixture"}
  },
  "slide_plan": [
    {
      "slide_id": "s1",
      "sequence_number": 1,
      "slide_type": "title",
      "title": "Governed automation for scaling ops teams",
      "purpose": "Establish relevance",
      "key_message": "Reduce manual handoffs with governed automation",
      "supporting_points": ["Mid-market SaaS context"],
      "evidence_references": [{"source_id": "offer-v1", "claim": "value_prop"}],
      "claim_references": [],
      "content_blocks": [
        {
          "block_id": "b1",
          "block_type": "headline",
          "content_summary": "Governed automation for scaling ops teams",
          "source_references": [{"source_id": "offer-v1"}],
          "priority": "primary",
          "maximum_density": "low",
          "visual_role": "title",
          "accessibility_text_required": true,
          "provenance": {}
        }
      ],
      "visual_requirements": [],
      "chart_requirements": [],
      "image_requirements": [],
      "layout_recommendation": "title_centered",
      "speaker_note_requirements": {"detail_level": "medium"},
      "transition_from_previous": "opening",
      "transition_to_next": "problem framing",
      "accessibility_notes": ["High contrast title text"],
      "unsupported_or_missing_evidence": [],
      "human_review_required": false,
      "provenance": {}
    },
    {
      "slide_id": "s2",
      "sequence_number": 2,
      "slide_type": "problem",
      "title": "Manual routing slows response times",
      "purpose": "Establish pain",
      "key_message": "Ticket routing delays hurt CSAT",
      "supporting_points": ["Handoffs between teams", "No audit trail"],
      "evidence_references": [{"source_id": "research-001", "claim": "routing_delay"}],
      "claim_references": [],
      "content_blocks": [],
      "visual_requirements": [],
      "chart_requirements": [],
      "image_requirements": [],
      "layout_recommendation": "two_column",
      "speaker_note_requirements": {"detail_level": "high"},
      "transition_from_previous": "from title",
      "transition_to_next": "solution",
      "accessibility_notes": ["Bullets readable at distance"],
      "unsupported_or_missing_evidence": [],
      "human_review_required": false,
      "provenance": {}
    },
    {
      "slide_id": "s3",
      "sequence_number": 3,
      "slide_type": "CTA",
      "title": "Start a bounded pilot",
      "purpose": "Drive next step",
      "key_message": "Schedule a pilot scoping workshop",
      "supporting_points": ["Low-risk entry", "Measurable success criteria"],
      "evidence_references": [],
      "claim_references": [],
      "content_blocks": [],
      "visual_requirements": [],
      "chart_requirements": [],
      "image_requirements": [],
      "layout_recommendation": "cta_focus",
      "speaker_note_requirements": {"detail_level": "medium"},
      "transition_from_previous": "from proof",
      "transition_to_next": "end",
      "accessibility_notes": ["CTA button contrast AA"],
      "unsupported_or_missing_evidence": [],
      "human_review_required": true,
      "provenance": {}
    }
  ],
  "slide_count": 3,
  "section_structure": [{"section": "opening", "slides": ["s1", "s2"]}, {"section": "close", "slides": ["s3"]}],
  "visual_briefs": [
    {
      "visual_id": "v1",
      "visual_type": "diagram",
      "objective": "Show workflow handoff reduction",
      "subject": "Before/after routing diagram",
      "composition": "Left-right comparison",
      "information_hierarchy": "Problem left, solution right",
      "required_elements": ["two lanes", "handoff arrows"],
      "prohibited_elements": ["vendor logos without approval"],
      "brand_constraints": {},
      "accessibility_requirements": {"alt_text": "Workflow comparison diagram"},
      "source_asset_references": [],
      "evidence_or_data_references": [{"source_id": "research-001"}],
      "renderer_neutral_description": "Simple comparison diagram with labeled steps",
      "human_review_required": false,
      "provenance": {}
    }
  ],
  "chart_requirements": [
    {
      "chart_id": "c1",
      "chart_purpose": "Show routing time improvement",
      "chart_type": "bar",
      "data_reference": {"source_id": "research-001", "dataset": "routing_times"},
      "measure_fields": ["median_minutes"],
      "dimension_fields": ["period"],
      "comparison_basis": "before vs after pilot",
      "required_labels": ["Before", "After"],
      "source_note": "Pilot customer anonymized",
      "uncertainty_notes": "Single customer sample",
      "accessibility_description": "Bar chart comparing median routing minutes",
      "prohibited_distortions": ["truncated_axis"],
      "provenance": {}
    }
  ],
  "image_requirements": [],
  "theme_recommendation": {
    "theme_family": "business",
    "selection_reason": "Sales audience expects professional clarity",
    "audience_fit": "high",
    "content_fit": "high",
    "readability": "high",
    "accessibility": {"contrast_reviewed": true},
    "brand_fit": "neutral",
    "background_strategy": "light neutral",
    "accent_strategy": "single accent for CTA",
    "typography_direction": "sans-serif, high legibility, no proprietary fonts",
    "image_style_direction": "clean diagrams over stock photos",
    "chart_style_direction": "minimal gridlines",
    "limitations": ["No remote font loading"],
    "provider_neutral": true,
    "provenance": {}
  },
  "typography_recommendation": {
    "heading_characteristics": "bold sans-serif",
    "body_characteristics": "regular sans-serif 18pt equivalent",
    "no_proprietary_fonts": true
  },
  "accessibility_requirements": {
    "minimum_body_text_guidance": "18pt equivalent minimum",
    "contrast_requirement": "WCAG AA",
    "color_independence": "Do not rely on color alone for meaning",
    "alt_text_required": true,
    "chart_description_required": true,
    "reading_order": "title, key message, supporting points, visual",
    "subtitle_or_transcript_requirement": "speaker notes for complex slides",
    "reduced_motion_requirement": "avoid animated transitions in spec",
    "language_and_direction": "en-LTR",
    "cognitive_load_notes": "Max one key message per slide"
  },
  "speaker_note_strategy": {"default_detail": "medium", "cta_slide": "high"},
  "CTA_strategy": {
    "primary_action": "Schedule pilot scoping workshop",
    "placement": "final slide",
    "aligned_with_objective": true
  },
  "source_content_references": [{"source_id": "offer-v1"}],
  "evidence_map": [{"claim": "routing_delay", "source_id": "research-001"}],
  "claim_safety_findings": [],
  "unsupported_claims": [],
  "source_content_gaps": [],
  "assumptions": ["Pilot customer data representative"],
  "unknowns": [],
  "presentation_risks": [],
  "pattern_references": [
    {
      "pattern_id": "source_lineage_preservation",
      "library_version": "0.1.0-frozen",
      "library_semantic_hash": "1ddd0d033f6028bd5dcf5ee555186c6be0389a96459615b6221348783d9b1883",
      "selection_reason": "Preserve source lineage in evidence map",
      "maturity": "reviewed",
      "runtime_authorized": false
    }
  ],
  "evidence_gaps": [],
  "coverage": "partial",
  "evidence_quality": "partial",
  "research_status": "partially_complete",
  "presentation_readiness": "ready_for_rendering_review",
  "renderer_requirements": {
    "accepted_future_renderers": ["marp", "pptx", "pdf"],
    "renderer_selected": null,
    "specification_only": true
  },
  "human_review_required": true,
  "provenance": {
    "skill_id": "ms.skill.presentation_architecture",
    "skill_version": "0.1.0",
    "methodology": "presentation-architecture-methodology.md"
  },
  "input_hash": "aaaaaaaaaaaaaaaaaaaaaaaaaaaaaaaaaaaaaaaaaaaaaaaaaaaaaaaaaaaaaaaa",
  "output_hash": "bbbbbbbbbbbbbbbbbbbbbbbbbbbbbbbbbbbbbbbbbbbbbbbbbbbbbbbbbbbbbbbb"
}
