{
  "presentation_id": "pres-tech-001",
  "skill_id": "ms.skill.presentation_architecture",
  "skill_version": "0.1.0",
  "presentation_objective": "Review system architecture for platform team",
  "presentation_type": "technical_architecture",
  "audience_summary": "Platform engineers",
  "narrative_arc": {
    "arc_id": "arc-tech-001",
    "arc_type": "technical_system_walkthrough",
    "opening": "Context",
    "conclusion": "Next steps",
    "source_references": [],
    "provenance": {}
  },
  "slide_plan": [
    {
      "slide_id": "t1",
      "sequence_number": 1,
      "slide_type": "architecture",
      "title": "Service boundaries",
      "purpose": "Explain components",
      "key_message": "Skills remain non-executable specifications",
      "supporting_points": ["No runtime in 01.6"],
      "evidence_references": [],
      "content_blocks": [],
      "layout_recommendation": "diagram_focus",
      "speaker_note_requirements": {},
      "accessibility_notes": [],
      "human_review_required": false,
      "provenance": {}
    }
  ],
  "slide_count": 1,
  "section_structure": [],
  "visual_briefs": [],
  "chart_requirements": [],
  "image_requirements": [],
  "theme_recommendation": {
    "theme_family": "technical",
    "selection_reason": "Engineering audience",
    "audience_fit": "high",
    "readability": "high",
    "accessibility": {"contrast_reviewed": true},
    "typography_direction": "monospace for code refs only",
    "provider_neutral": true,
    "provenance": {}
  },
  "typography_recommendation": {},
  "accessibility_requirements": {
    "minimum_body_text_guidance": "16pt equivalent",
    "contrast_requirement": "WCAG AA",
    "color_independence": true,
    "alt_text_required": true,
    "chart_description_required": true,
    "reading_order": "logical"
  },
  "speaker_note_strategy": {},
  "CTA_strategy": {"aligned_with_objective": true},
  "source_content_references": [],
  "evidence_map": [],
  "claim_safety_findings": [],
  "unsupported_claims": [],
  "source_content_gaps": [],
  "assumptions": [],
  "unknowns": [],
  "presentation_risks": [],
  "evidence_gaps": [],
  "coverage": "minimal",
  "evidence_quality": "partial",
  "research_status": "partially_complete",
  "presentation_readiness": "partially_ready",
  "renderer_requirements": {"specification_only": true},
  "human_review_required": true,
  "provenance": {},
  "input_hash": "cccccccccccccccccccccccccccccccccccccccccccccccccccccccccccccccc",
  "output_hash": "dddddddddddddddddddddddddddddddddddddddddddddddddddddddddddddddd"
}
